Name, Department, Title, Age, Salary, Address
John Doe, Engineering, Senior Engineer, 35, 75000, "123 Main St, Leeds"
Jane Smith, Marketing, Marketing Manager, 40, 90000, "456 Elm St, Leeds"
Alice Johnson, Finance, Accountant, 28, 60000, "789 Oak St, Leeds"
Bob Williams, Sales, Sales Representative, 32, 55000, "321 Maple St, Leeds"
Eve Davis, Human Resources, HR Specialist, 30, 50000, "654 Pine St, Leeds"
Mohammed Ali, Engineering, Software Developer, 27, 80000, "987 Cedar St, Leeds"
Maria Garcia, Finance, Financial Analyst, 31, 65000, "543 Birch St, Leeds"
Chen Wei, Marketing, Digital Marketing Specialist, 29, 60000, "876 Spruce St, Leeds"
Alexandra Petrova, Sales, Sales Manager, 38, 95000, 234 "Walnut St, Leeds
Kim" Nguyen, Engineering, Data Scientist, 33, 85000, "567 Pine St, Leeds"
Ravi Patel, Human Resources, Recruitment Specialist, 26, 50000, "890 Elm St, Leeds"
Luis Ramirez, Finance, Financial Controller, 42, 100000, "123 Oak St, Leeds"
Sara Ahmed, Marketing, Marketing Coordinator, 27, 55000, "456 Maple St, Leeds"
Yuki Tanaka, Sales, Sales Associate, 24, 45000, "789 Birch St, Leeds"
Priya Sharma, Engineering, Quality Assurance Engineer, 31, 70000, "321 Spruce St, Leeds"
Emma Wilson, Human Resources, HR Manager, 39, 95000, "654 Cedar St, Leeds"
Carlos Hernandez, Finance, Auditor, 35, 70000, "987 Oak St, Leeds"
Sophie Leclerc, Marketing, Product Manager, 37, 90000, "543 Walnut St, Leeds"
Joshua Lee, Sales, Business Development Manager, 36, 95000, "876 Maple St, Leeds"
Mehmet Yılmaz, Engineering, Systems Analyst, 32, 80000, "234 Pine St, Leeds"